{
  "event_id": "01J9A1B2C3D4E5F6G7H8J9K0MP",
  "app": "terakidz",
  "app_account_ref": "7f3c2a10-5b1e-4c7d-9a2f-0e6b8d4c1a23",
  "plan_code": "premium-30d",
  "status": "active",
  "valid_from": "2026-09-28T03:05:00Z",
  "valid_until": "2026-10-28T03:05:00Z",
  "issued_at": "2026-09-28T03:05:01Z"
}
